{
  "version": 3,
  "enforcement": "enforce",
  "notify_before_days": 30,
  "grace_days": 14,
  "expiry_action": "restrict",
  "restricted_caps": [
    "updates"
  ],
  "restricted_days": null,
  "hard_block_mode": "read_only",
  "read_only_caps": [
    "view",
    "print",
    "export"
  ],
  "offline_grace_days": null,
  "check_interval_hours": 24,
  "release_after_days": 30
}
